{
  "available_effort_labels_hash": "sha256:3783e2e25fe2fb31540b46f44b69c10dc8b03f2f2b19b76dd105a3bcb503bdf4",
  "browser_effort_strategy": "select_highest_visible",
  "bundle_version": "v18.0.0",
  "capture_confidence": "high",
  "created_at": "2026-05-12T00:00:10Z",
  "effort_rank": "highest_visible",
  "evidence_id": "evidence-demo-chatgpt_pro_first_plan",
  "evidence_privacy": {
    "stores_account_identifiers": false,
    "stores_cookies": false,
    "stores_raw_dom": false,
    "stores_raw_screenshots": false
  },
  "failure_code": null,
  "fix_command": null,
  "mode_verified": true,
  "next_command": null,
  "observed_mode_label_hash": "sha256:d7b7c908e3e34240373fc3f039ce138181d3c7d110b6cedb7c7c5eb86fc540b9",
  "observed_reasoning_effort_label": "Heavy",
  "output_text_sha256": "sha256:1a8f9f53b1c104b8e875b567fa926c96106866aa67b84ceb0ae9b79cc2b6f069",
  "prompt_sha256": "sha256:8066ce46612720cc9fef084e87ff90b1eec0f7f9fa6c41988018601257fe8791",
  "prompt_submitted_at": "2026-05-12T00:00:05Z",
  "provider": "chatgpt",
  "provider_result_id": "provider-result-demo-chatgpt_pro_first_plan",
  "provider_slot": "chatgpt_pro_first_plan",
  "reasoning_effort_verification_method": "model_picker_label",
  "reasoning_effort_verified": true,
  "redaction_policy": "redacted",
  "requested_mode": "pro_extended_reasoning",
  "requested_reasoning_effort": "max_browser_available",
  "run_id": "run-demo",
  "schema_version": "browser_evidence.v1",
  "selected_effort_is_highest_visible": true,
  "selector_manifest_version": "chatgpt-pro-v1",
  "session_id_hash": "sha256:2a97516c354b68848cdbd8f54a226a0a55b21ed138e207ad6c5cbb9c00aa5aea",
  "transition_log_sha256": "sha256:9c9c239de9790a1c12bbda6a34c7fc8b69c05612237dfb3cedaedd3a130fd82f",
  "unsafe_artifacts_quarantined": true,
  "verification_method": "same_session_ui_observation_plus_selector_trace",
  "verification_scope": "same_browser_session_before_prompt_submit",
  "verified_at": "2026-05-12T00:00:00Z",
  "verified_before_prompt_submit": true
}
