{
  "available_effort_labels_hash": "sha256:4444444444444444444444444444444444444444444444444444444444444444",
  "browser_effort_strategy": "select_highest_visible",
  "bundle_version": "v18.0.0",
  "capture_confidence": "high",
  "created_at": "2026-05-13T00:00:00Z",
  "effort_rank": "highest_visible",
  "evidence_id": "evidence-conformance-chatgpt-first-plan",
  "mode_verified": true,
  "observed_reasoning_effort_label": "Heavy",
  "output_text_sha256": "sha256:5555555555555555555555555555555555555555555555555555555555555555",
  "prompt_sha256": "sha256:6666666666666666666666666666666666666666666666666666666666666666",
  "prompt_submitted_at": "2026-05-13T00:01:00Z",
  "provider": "chatgpt",
  "provider_result_id": "provider-result-conformance-chatgpt-first-plan",
  "provider_slot": "chatgpt_pro_first_plan",
  "reasoning_effort_verified": true,
  "redaction_policy": "redacted",
  "requested_mode": "pro_extended_reasoning",
  "requested_reasoning_effort": "max_browser_available",
  "run_id": "run-conformance",
  "schema_version": "browser_evidence.v1",
  "selected_effort_is_highest_visible": true,
  "selector_manifest_version": "chatgpt-pro-v1",
  "session_id_hash": "sha256:7777777777777777777777777777777777777777777777777777777777777777",
  "transition_log_sha256": "sha256:8888888888888888888888888888888888888888888888888888888888888888",
  "unsafe_artifacts_quarantined": true,
  "verification_method": "same_session_ui_observation_plus_selector_trace",
  "verification_scope": "same_browser_session_before_prompt_submit",
  "verified_at": "2026-05-13T00:00:30Z",
  "verified_before_prompt_submit": true
}
