{
  "available_effort_labels_hash": "sha256:e72969183152b5ea46db3e3e428ce20a1f5929ad0f6de0d68501335294b433ac",
  "browser_effort_strategy": "select_deep_think_and_highest_thinking_level_if_exposed",
  "bundle_version": "v18.0.0",
  "capture_confidence": "high",
  "created_at": "2026-05-12T00:00:10Z",
  "effort_rank": "deep_think_selected_and_highest_visible",
  "evidence_id": "evidence-demo-gemini_deep_think",
  "evidence_privacy": {
    "stores_account_identifiers": false,
    "stores_cookies": false,
    "stores_raw_dom": false,
    "stores_raw_screenshots": false
  },
  "failure_code": null,
  "fix_command": null,
  "mode_verified": true,
  "next_command": null,
  "observed_mode_label_hash": "sha256:d7b7c908e3e34240373fc3f039ce138181d3c7d110b6cedb7c7c5eb86fc540b9",
  "observed_reasoning_effort_label": "Deep Think",
  "output_text_sha256": "sha256:1a8f9f53b1c104b8e875b567fa926c96106866aa67b84ceb0ae9b79cc2b6f069",
  "prompt_sha256": "sha256:8066ce46612720cc9fef084e87ff90b1eec0f7f9fa6c41988018601257fe8791",
  "prompt_submitted_at": "2026-05-12T00:00:05Z",
  "provider": "gemini",
  "provider_result_id": "provider-result-demo-gemini_deep_think",
  "provider_slot": "gemini_deep_think",
  "reasoning_effort_verification_method": "deep_think_mode_label",
  "reasoning_effort_verified": true,
  "redaction_policy": "redacted",
  "requested_mode": "gemini_3_1_pro_deep_think",
  "requested_reasoning_effort": "deep_think_highest_available",
  "run_id": "run-demo",
  "schema_version": "browser_evidence.v1",
  "selected_effort_is_highest_visible": true,
  "selector_manifest_version": "gemini-deep-think-v1",
  "session_id_hash": "sha256:2a97516c354b68848cdbd8f54a226a0a55b21ed138e207ad6c5cbb9c00aa5aea",
  "thinking_level_if_exposed": "high",
  "thinking_level_verified": true,
  "transition_log_sha256": "sha256:9c9c239de9790a1c12bbda6a34c7fc8b69c05612237dfb3cedaedd3a130fd82f",
  "unsafe_artifacts_quarantined": true,
  "verification_method": "same_session_ui_observation_plus_selector_trace",
  "verification_scope": "same_browser_session_before_prompt_submit",
  "verified_at": "2026-05-12T00:00:00Z",
  "verified_before_prompt_submit": true
}
